placeUrl,title,rating,reviewCount,category,attributes,address,plusCode,website,,,,,,,,imgUrl,isClaimed,query,timestamp,phoneNumber
"https://www.google.com/maps/place/Rajan+Corner/@28.6594127,77.1317867,15z/data=!4m8!1m2!2m1!1sRestaurants+in+Moti+Nagar!3m4!1s0x390d0306e091fe55:0x50fca50d84517846!8m2!3d28.6588307!4d77.14143?hl=en",Rajan Corner,4.2,1269,South Indian restaurant,Cash-only · Casual · Good for kids,"Durga Mata Mandir Road, Block C, Block 6, Moti Nagar, New Delhi, Delhi 110015, India","M45R+GH Delhi, India",,,,,,,,,https://lh5.googleusercontent.com/p/AF1QipNVrwxQPXByvpB8ebyLKSD3_LtOftrY_DvllnE8=w408-h482-k-no,,Restaurants in Moti Nagar,2020-02-17T07:16:17.398Z,
"https://www.google.com/maps/place/The+MARKETPLACE/@28.6594127,77.1317867,15z/data=!4m8!1m2!2m1!1sRestaurants+in+Moti+Nagar!3m4!1s0x390d035509e7d9ab:0x9b4f1ecc4d23982c!8m2!3d28.6557559!4d77.1383222?hl=en",The MARKETPLACE,4,1864,Restaurant,Reservations required · All you can eat · Outdoor seating,"A-8, Main Najafgarh Road,Metro Pillar No-326 Kailash Park, Kirti Nagar, Opp. Kalra Hospital, Basai Dara pur, Bali Nagar, New Delhi, Delhi 110015, India","M44Q+88 Bali Nagar, New Delhi, Delhi, India",,,,,,,,,,TRUE,Restaurants in Moti Nagar,2020-02-17T07:16:19.568Z,+91 97110 98899
"https://www.google.com/maps/place/Clay+1+grill/@28.6594127,77.1317867,15z/data=!4m8!1m2!2m1!1sRestaurants+in+Moti+Nagar!3m4!1s0x390d0305dff4c347:0xcb063b89a76b582b!8m2!3d28.6539504!4d77.136495?hl=en",Clay 1 grill,4,3753,North Indian restaurant,Late-night food · All you can eat · Cozy,"Metro Pillar Number 325, A-10, Najafgarh Rd, opposite Kalra hospital, Moti Nagar, Kailash Park, Basai Dara pur, Kirti Nagar, Delhi, 110015, India","M43P+HH Kirti Nagar, New Delhi, Delhi, India",zomato.com,,,,,,,,,TRUE,Restaurants in Moti Nagar,2020-02-17T07:16:20.880Z,+91 98188 82536
"https://www.google.com/maps/place/Kumar+Hotel/@28.6594127,77.1317867,15z/data=!4m8!1m2!2m1!1sRestaurants+in+Moti+Nagar!3m4!1s0x390d0306882a686b:0xdcc4c6209739ec77!8m2!3d28.6568872!4d77.1399869?hl=en",Kumar Hotel,4,540,Restaurant,Cash-only · Late-night food · All you can eat,"No.A-12/12-13, New Market, Near Fun Cinema, Moti Nagar, New Delhi, Delhi 110015, India","M44Q+QX Delhi, India",,,,,,,,,,TRUE,Restaurants in Moti Nagar,2020-02-17T07:16:23.867Z,+91 99111 51300
"https://www.google.com/maps/place/Kumar+Samosa+Wala/@28.6594127,77.1317867,15z/data=!4m8!1m2!2m1!1sRestaurants+in+Moti+Nagar!3m4!1s0x390d03aa39fbb415:0xc63a503f63e501d8!8m2!3d28.664304!4d77.143831?hl=en",Kumar Samosa Wala,4.3,2547,Fast food restaurant,Cash-only · Casual · Vegetarian options,"2/31 phase, 3, New Moti Nagar, Moti Nagar, New Delhi, Delhi 110015, India","M47V+PG Delhi, India",kumarsamosawala.com,,,,,,,,,,Restaurants in Moti Nagar,2020-02-17T07:16:27.279Z,+91 98113 40381
"https://www.google.com/maps/place/C+L+Corner/@28.6594127,77.1317867,15z/data=!4m8!1m2!2m1!1sRestaurants+in+Moti+Nagar!3m4!1s0x390d0306864d4e7f:0x8acd3816e3ac4728!8m2!3d28.656769!4d77.1400739?hl=en",C L Corner,4.2,770,Punjabi restaurant,Cash-only · Casual · Good for kids,"Shivaji Marg, Moti Nagar, Block A, Moti Nagar, Delhi, 110015, India","M44R+P2 Moti Nagar, House Complex Market, Karampura Industrial Area, Karam Pura, New Delhi, Delhi, India",,,,,,,,,,TRUE,Restaurants in Moti Nagar,2020-02-17T07:16:31.456Z,+91 98111 10080
"https://www.google.com/maps/place/Shop+no+05,+Pizzato+Brother's,+opp.+vishal+jwellers,+Mini+Market,+Moti+Nagar,+New+Delhi,+Delhi+110015,+India/@28.6594127,77.1317867,15z/data=!4m5!1m2!2m1!1sRestaurants+in+Moti+Nagar!3m1!1s0x390d0340180b7857:0x64bfb2661808b0c4?hl=en",Pizzato Brother's,4.9,97,Pizza restaurant,Casual · Good for kids · Groups,"Shop no 05, opp. vishal jwellers, Mini Market, Moti Nagar, New Delhi, Delhi 110015, India","M46R+XC Moti Nagar, New Delhi, Delhi, India",pizzatobrothers.com,,,,,,,,,TRUE,Restaurants in Moti Nagar,2020-02-17T07:16:33.489Z,+91 85888 98344
"https://www.google.com/maps/place/Rajindra+Refreshment/@28.6594127,77.1317867,15z/data=!4m8!1m2!2m1!1sRestaurants+in+Moti+Nagar!3m4!1s0x390d030076e781f5:0x6ea1c4f3a6866a0c!8m2!3d28.6622743!4d77.1466361?hl=en",Rajindra Refreshment,4.2,192,Punjabi restaurant,Casual · Good for kids · Groups,"Corner Shop, Super Mkt, Karam Pura, New Delhi, Delhi 110015, India","M46W+WM Delhi, India",,,,,,,,,,,Restaurants in Moti Nagar,2020-02-17T07:16:35.071Z,+91 99997 92120
"https://www.google.com/maps/place/Raja+Snacks+Bar/@28.6594127,77.1317867,15z/data=!4m8!1m2!2m1!1sRestaurants+in+Moti+Nagar!3m4!1s0x390d03000d492aa3:0x5f4b2c4fcd30acd3!8m2!3d28.661853!4d77.147303?hl=en",Raja Snacks Bar,4.2,597,South Indian restaurant,Cash-only · Casual · Good for kids,"G-10 Harsha House Complex Karampura Moti Nagar, opposite, Milan Cinema Rd, Karampura Market, Karam Pura, Delhi, 110015, India","M46W+PW Karam Pura, New Delhi, Delhi, India",,,,,,,,,https://lh5.googleusercontent.com/p/AF1QipNEZS_2bETu2gARosOPURKsFZVwkAn3QQZ69LxK=w408-h306-k-no,TRUE,Restaurants in Moti Nagar,2020-02-17T07:16:37.380Z,+91 97111 72371
"https://www.google.com/maps/place/Budget+Bites,+Block+C,+New+Moti+Nagar,+Moti+Nagar,+New+Delhi,+Delhi+110015,+India/@28.6594127,77.1317867,15z/data=!4m5!1m2!2m1!1sRestaurants+in+Moti+Nagar!3m1!1s0x390d03aafbeb2fed:0x74d1e9ef24c31c01?hl=en",Budget Bites,4.8,32,Restaurant,Casual · Good for kids · Groups,"Block C, New Moti Nagar, Moti Nagar, New Delhi, Delhi 110015, India","M47V+QH Moti Nagar, New Delhi, Delhi, India",,,,,,,,,,TRUE,Restaurants in Moti Nagar,2020-02-17T07:16:39.111Z,+91 78358 28282
"https://www.google.com/maps/place/Pind+Balluchi+Motinagar/@28.6594127,77.1317867,15z/data=!4m8!1m2!2m1!1sRestaurants+in+Moti+Nagar!3m4!1s0x390d030f57edbbfd:0x7f8086dc74832c5b!8m2!3d28.6550975!4d77.1369684?hl=en",Pind Balluchi Motinagar,3.7,808,Restaurant,Late-night food · All you can eat · Cozy,"Metro Pillar Number 333, Metro Station, I-7, Najafgarh Rd, Kailash Park, Moti Nagar, New Delhi, Delhi 110015, India","M44P+2Q Moti Nagar, New Delhi, Delhi, India",pindballuchi.com,,,,,,,,,TRUE,Restaurants in Moti Nagar,2020-02-17T07:16:41.369Z,+91 11 4053 6235
"https://www.google.com/maps/place/Guru+Rakha/@28.6594127,77.1317867,15z/data=!4m8!1m2!2m1!1sRestaurants+in+Moti+Nagar!3m4!1s0x390d030076bf9131:0x14098a9a65e3c7a3!8m2!3d28.6621782!4d77.1466199?hl=en",Guru Rakha,3.9,878,North Indian restaurant,All you can eat · Casual · Good for kids,"T 41, 42, Milan Cinema Rd, Near Milan Cinema, Block TC, New Moti Nagar, Moti Nagar, New Delhi, Delhi 110015, India","M46W+VJ Delhi, India",,,,,,,,,https://lh5.googleusercontent.com/p/AF1QipOv9thbQVnbUaPD7h1NSwbdFEKHz_g2jtRNfuyo=w523-h240-k-no,,Restaurants in Moti Nagar,2020-02-17T07:16:43.098Z,+91 11 2544 1296
"https://www.google.com/maps/place/Garniche+-+Chef+at+your+doorstep/@28.6594127,77.1317867,15z/data=!4m8!1m2!2m1!1sRestaurants+in+Moti+Nagar!3m4!1s0x390d03a9dc3b8e7f:0xc4ce0e5dc6172c19!8m2!3d28.6615026!4d77.1337799?hl=en",Garniche - Chef at your doorstep,5,93,Restaurant,Reservations required · Happy hour food · Late-night food,"C - 675, Block B, Sudershan Park, New Delhi, Delhi 110015, India","M46M+JG Sudershan Park, New Delhi, Delhi, India",garniche.io,,,,,,,,,TRUE,Restaurants in Moti Nagar,2020-02-17T07:16:44.357Z,+91 99108 78703
"https://www.google.com/maps/place/Bahadur+Restaurant/@28.6594127,77.1317867,15z/data=!4m8!1m2!2m1!1sRestaurants+in+Moti+Nagar!3m4!1s0x390d0306ca955567:0xac6808b777d305d6!8m2!3d28.66138!4d77.1472567?hl=en",Bahadur Restaurant,3.6,359,North Indian restaurant,Cash-only · Late-night food · Casual,"T-72-73-74, Super Market, near Milan Cinema, Moti Nagar, New Delhi, Delhi 110015, India","M46W+HW Moti Nagar, New Delhi, Delhi, India",,,,,,,,,,TRUE,Restaurants in Moti Nagar,2020-02-17T07:16:46.794Z,+91 98993 29823
"https://www.google.com/maps/place/CHINESE+FOOD+CORNER,+5%2F29,Opposite+Comm.+Centre,,+Moti+Nagar,+Delhi+110015,+India/@28.6594127,77.1317867,15z/data=!4m5!1m2!2m1!1sRestaurants+in+Moti+Nagar!3m1!1s0x390d0306555aaaaf:0xbbd8472ee78c6314?hl=en",CHINESE FOOD CORNER,4,172,Chinese restaurant,Casual · Good for kids · Groups,"5/29,Opposite Comm. Centre,, Moti Nagar, Delhi 110015, India","M45Q+HW Moti Nagar, House Complex Market, Karampura Industrial Area, Karam Pura, New Delhi, Delhi, India",,,,,,,,,,TRUE,Restaurants in Moti Nagar,2020-02-17T07:16:49.535Z,+91 98734 48460
"https://www.google.com/maps/place/Sindhi+Chat+Corner/@28.6594127,77.1317867,15z/data=!4m8!1m2!2m1!1sRestaurants+in+Moti+Nagar!3m4!1s0x390d03a883f5090b:0xeb5f285bac320900!8m2!3d28.6648767!4d77.1372068?hl=en",Sindhi Chat Corner,3.7,138,Fast food restaurant,Cash-only · Casual · Good for kids,"D-113, D-113, Shri Satguru Sahibji Marg, Block D, Moti Nagar, New Delhi, Delhi 110015, India","M47P+XV Delhi, India",,,,,,,,,,,Restaurants in Moti Nagar,2020-02-17T07:16:50.813Z,+91 98112 42425
"https://www.google.com/maps/place/Aapki+Rasoi/@28.6594127,77.1317867,15z/data=!4m8!1m2!2m1!1sRestaurants+in+Moti+Nagar!3m4!1s0x390d0306b0cf97d1:0x4e63431fbe9527d5!8m2!3d28.6574024!4d77.1420921?hl=en",Aapki Rasoi,3.7,182,North Indian restaurant,All you can eat · Casual · Good for kids,"5, DLF, Industrial Area, Near Metro Station, Moti Nagar, Najaf Garh Road,, New Delhi, Delhi 110015, India","M44R+XR New Delhi, Delhi, India",,,,,,,,,,TRUE,Restaurants in Moti Nagar,2020-02-17T07:16:53.171Z,+91 99538 64666
"https://www.google.com/maps/place/Haldiram's/@28.6594127,77.1317867,15z/data=!4m8!1m2!2m1!1sRestaurants+in+Moti+Nagar!3m4!1s0x390d02ffe8430c2d:0xbf4269d31574fbcb!8m2!3d28.6614865!4d77.1498762?hl=en",Haldiram's,4.2,6359,South Indian restaurant,All you can eat · Cozy · Casual,"Ground Plot No 19A, Shivaji Marg, Moti Nagar, New Delhi, Delhi 110026, India","M46X+HX Delhi, India",haldiram.com,,,,,,,,,,Restaurants in Moti Nagar,2020-02-17T07:16:54.311Z,
"https://www.google.com/maps/place/Guru+Rakha+Restaurant/@28.6594127,77.1317867,15z/data=!4m8!1m2!2m1!1sRestaurants+in+Moti+Nagar!3m4!1s0x390d03aa189d9e4f:0x7191521c19b6b9d7!8m2!3d28.6635631!4d77.1432467?hl=en",Guru Rakha Restaurant,3.9,24,Restaurant,Casual · Good for kids · Groups,"Baba Karam Singh Marg, New Moti Nagar, Moti Nagar, Delhi, 110015, India","M47V+C7 Delhi, India",,,,,,,,,,,Restaurants in Moti Nagar,2020-02-17T07:16:55.459Z,
"https://www.google.com/maps/place/Sethi+Tiffin+Service/@28.6594127,77.1317867,15z/data=!4m8!1m2!2m1!1sRestaurants+in+Moti+Nagar!3m4!1s0x390d03a9f01b3445:0x62b1c43d5ed94e55!8m2!3d28.6627844!4d77.142074?hl=en",Sethi Tiffin Service,4.3,29,Restaurant,,"53, Baba Karam Singh Marg, Block I, Karampura West, Karam Pura, New Delhi, Delhi 110015, India","M47R+4R Delhi, India",,,,,,,,,,,Restaurants in Moti Nagar,2020-02-17T07:16:57.026Z,
"https://www.google.com/maps/place/Fiery+Grills-+Best+Restaurants+in+NSP+Pitampura+%7C+Best+Buffet+in+Pitampura+%7C+Barbecue+in+Pitampura/@28.6925215,77.1485202,17z/data=!4m8!1m2!2m1!1sRestaurants+in+NSP!3m4!1s0x390d03aa07751bcd:0xed9ff28f939413d!8m2!3d28.6928808!4d77.1526042?hl=en",Fiery Grills- Best Restaurants in NSP Pitampura | Best Buffet in Pitampura | Barbecue in Pitampura,4.2,272,Barbecue restaurant,Happy hour food · All you can eat · Cozy,"306 3rd Floor, D Mall, Netaji Subhash Place, Pitam Pura, New Delhi, Delhi 110034, India","M5V3+52 Pitam Pura, New Delhi, Delhi, India",fierygrills.co,,,,,,,,https://lh5.googleusercontent.com/p/AF1QipMZl8GVghn27GtFGaGe140FBOauiei9q62VbLud=w408-h271-k-no,TRUE,Restaurants in NSP,2020-02-17T07:17:09.957Z,+91 81308 15557
"https://www.google.com/maps/place/Themis+Barbecue+House/@28.6925215,77.1485202,17z/data=!4m8!1m2!2m1!1sRestaurants+in+NSP!3m4!1s0x390d02331a2c3907:0x81a0a521e3dd9d19!8m2!3d28.694014!4d77.149292?hl=en",Themis Barbecue House,4,3574,Barbecue restaurant,Late-night food · All you can eat · Outdoor seating,"Aggarwal Millennium Tower 1, 251, 2nd Floor, B, Netaji Subash Place, Pandit Lekhram Sharma Marg, Block C3, Keshav Puram, Tri Nagar, New Delhi, Delhi 110035, India","M4VX+JP Tri Nagar, Delhi, India",business.site,,,,,,,,,TRUE,Restaurants in NSP,2020-02-17T07:17:12.905Z,+91 95991 00165
"https://www.google.com/maps/place/Sura+Vie/@28.6925215,77.1485202,17z/data=!4m8!1m2!2m1!1sRestaurants+in+NSP!3m4!1s0x390d0233183a8ea7:0x576e2b11e00f8b63!8m2!3d28.69377!4d77.150067?hl=en",Sura Vie,3.9,1055,Eclectic restaurant,Late-night food · All you can eat · Cozy,"101, Agarwal Cyber Plaza, 1, Netaji Subhash Place, Pitam Pura, New Delhi, Delhi 110034, India","M5V2+G2 Pitam Pura, New Delhi, Delhi, India",,,,,,,,,https://lh5.googleusercontent.com/proxy/ATWX5Zn2xpI0vkV8CvoDoPz5DPlXdRm-_pqCZsXvIEYL2mppaAPovpQhwTgIyc7bgxzhSMO2tJDiISw2DwfTNrt40x34bXSwycOIETs4M478zxfkSKx7c5TVzCsJCOwNvVV4lG_w0Fx5aKfZYncFTU5pwMroHw=w420-h240-k-no,TRUE,Restaurants in NSP,2020-02-17T07:17:17.494Z,+91 78279 97592
"https://www.google.com/maps/place/Million+Dollar/@28.6925215,77.1485202,17z/data=!4m8!1m2!2m1!1sRestaurants+in+NSP!3m4!1s0x390d0234a88795b1:0x912e87cff1c9910f!8m2!3d28.6912443!4d77.1492591?hl=en",Million Dollar,4,1246,North Indian restaurant,Happy hour food · Late-night food · All you can eat,"Krishna Apra Plaza, G-51, Netaji Subhash Place, Pitam Pura, New Delhi, Delhi 110034, India","M4RX+FP Pitam Pura, New Delhi, Delhi, India",million-dollar.business.site,,,,,,,,https://lh5.googleusercontent.com/p/AF1QipPu5BcJejVZmb8C4cP4FvLa9hDUJuPAffWPJ2sv=w427-h240-k-no,TRUE,Restaurants in NSP,2020-02-17T07:17:24.146Z,+91 99104 71478
"https://www.google.com/maps/place/Eleven+Course/@28.6925215,77.1485202,17z/data=!4m8!1m2!2m1!1sRestaurants+in+NSP!3m4!1s0x390d02349059e127:0xe861bc41d1de098d!8m2!3d28.6910291!4d77.1498739?hl=en",Eleven Course,4.2,1573,Vegetarian restaurant,All you can eat · Cozy · Casual,"First Floor, NDM - ll, Netaji Subhash Place, Wazirpur, Delhi, 110034, India","M4RX+CW Wazirpur, New Delhi, Delhi, India",elevencourse.com,,,,,,,,,TRUE,Restaurants in NSP,2020-02-17T07:17:29.894Z,+91 11 4551 4008
"https://www.google.com/maps/place/Barbeque+Nation+-+Delhi+-+Pitampura/@28.6925215,77.1485202,17z/data=!4m8!1m2!2m1!1sRestaurants+in+NSP!3m4!1s0x390d02335d6b032b:0x52a72eb126890b70!8m2!3d28.6922582!4d77.1516288?hl=en",Barbeque Nation - Delhi - Pitampura,4.3,3615,Barbecue restaurant,Reservations required · Happy hour food · Late-night food,"Plot No. A, 101 & 102, First Floor, Agarwal Corporate Heights, 7, Netaji Subhash Place, Pitam Pura, New Delhi, Delhi 110034, India","M5R2+WM Pitam Pura, New Delhi, Delhi, India",barbequenation.com,,,,,,,,https://lh5.googleusercontent.com/p/AF1QipMpncKTOxKpJ__hCBJkFTFcptls2DfjJ6y8yi4=w449-h240-k-no,TRUE,Restaurants in NSP,2020-02-17T07:17:34.623Z,+91 11 6480 6060
"https://www.google.com/maps/place/Best+Nightlife+In+Delhi+-+Xpose+Lounge+-+Best+Lounge+In+Delhi/@28.6925215,77.1485202,17z/data=!4m8!1m2!2m1!1sRestaurants+in+NSP!3m4!1s0x390cfd1cdcc089af:0x453f32f666729e77!8m2!3d28.691155!4d77.152099?hl=en",Best Nightlife In Delhi - Xpose Lounge - Best Lounge In Delhi,3.9,1546,Lounge,Cozy · Casual · Groups,"200 B, ITL Twin Tower, Netaji Subash Place, Ring Road, Pitam Pura, New Delhi, Delhi 110034, India","M5R2+FR Pitam Pura, New Delhi, Delhi, India",,,,,,,,,,TRUE,Restaurants in NSP,2020-02-17T07:17:38.200Z,+91 98733 22255
"https://www.google.com/maps/place/Billu's+Hut,+G-28,+Aggarwal+Millenium+Tower,+Netaji+Subhash+Place,+Wazirpur,+New+Delhi,+Delhi+560082,+India/@28.6925215,77.1485202,17z/data=!4m5!1m2!2m1!1sRestaurants+in+NSP!3m1!1s0x390d023325b8aa2f:0xe7e4f40ce90dfaf7?hl=en",Billu's Hut,4.2,6558,Fast food restaurant,Late-night food · Casual · Good for kids,"G-28, Aggarwal Millenium Tower, Netaji Subhash Place, Wazirpur, New Delhi, Delhi 560082, India","M4VX+FR Delhi, India",,,,,,,,,,TRUE,Restaurants in NSP,2020-02-17T07:17:40.242Z,
"https://www.google.com/maps/place/Kathi+Country+Pitampura,+Aggarwal+Cyber+Plaza+1,+G-47,+Netaji+Subhash+Place,+Pitam+Pura,+Delhi,+110034,+India/@28.6925215,77.1485202,17z/data=!4m5!1m2!2m1!1sRestaurants+in+NSP!3m1!1s0x390d037c82a06d6f:0x6bcca8caadec31f2?hl=en",Kathi Country Pitampura,5,23,Fast food restaurant,Casual · Good for kids · Groups,"Aggarwal Cyber Plaza 1, G-47, Netaji Subhash Place, Pitam Pura, Delhi, 110034, India","M4VX+GV Pitam Pura, New Delhi, Delhi, India",kathicountry.com,,,,,,,,,TRUE,Restaurants in NSP,2020-02-17T07:17:42.029Z,
"https://www.google.com/maps/place/Haldiram's/@28.6925215,77.1485202,17z/data=!4m8!1m2!2m1!1sRestaurants+in+NSP!3m4!1s0x390d0233eb1adf71:0x162b112f1c2faff7!8m2!3d28.6922596!4d77.1505872?hl=en",Haldiram's,4.1,3291,Restaurant,All you can eat · Casual · Vegetarian options,"D-Mall, Netaji Subhash Place, New Delhi, Delhi 110034, India","M5R2+W6 New Delhi, Delhi, India",haldiram.com,,,,,,,,,TRUE,Restaurants in NSP,2020-02-17T07:17:44.256Z,+91 120 240 0286
"https://www.google.com/maps/place/%23Hashtag+Foods,+G-89,+Aggarwal+Millenium+Tower,+Netaji+Subhash+Place,+New+Delhi,+Delhi+560082,+India/@28.6925215,77.1485202,17z/data=!4m5!1m2!2m1!1sRestaurants+in+NSP!3m1!1s0x390d023325b8aa2f:0x50b8e53d59d7d831?hl=en",#Hashtag Foods,4,487,Fast food restaurant,Casual · Good for kids · Groups,"G-89, Aggarwal Millenium Tower, Netaji Subhash Place, New Delhi, Delhi 560082, India","M5V3+34 Delhi, India",,,,,,,,,,,Restaurants in NSP,2020-02-17T07:17:45.944Z,+91 11 4556 5793
"https://www.google.com/maps/place/Burger+King/@28.6925215,77.1485202,17z/data=!4m8!1m2!2m1!1sRestaurants+in+NSP!3m4!1s0x390d0233114ee2f9:0x3be0712b140f7407!8m2!3d28.693325!4d77.150347?hl=en",Burger King,4.1,5489,Fast food restaurant,Casual · Vegetarian options · Good for kids,"UNIT NO.101 - 106, First Floor, Plot C 1, 2 & 3 PP Towers, Netaji Subhash Place, Pitam Pura, New Delhi, Delhi 110034, India","M5V2+84 Pitam Pura, New Delhi, Delhi, India",burgerkingindia.in,,,,,,,,,TRUE,Restaurants in NSP,2020-02-17T07:17:47.804Z,+91 11 4359 5838
"https://www.google.com/maps/place/Kake+Di+Hatti/@28.6925215,77.1485202,17z/data=!4m8!1m2!2m1!1sRestaurants+in+NSP!3m4!1s0x390d02339390c643:0x247b78b64dfc1afa!8m2!3d28.6927235!4d77.152877?hl=en",Kake Di Hatti,4,987,North Indian restaurant,Casual · Vegetarian options · Good for kids,"D Mall, 21,, Mahatma Gandhi Marg, Netaji Subhash Place, Pitam Pura, Delhi, 110034, India","M5V3+35 Pitam Pura, New Delhi, Delhi, India",,,,,,,,,https://lh4.googleusercontent.com/proxy/Ycoi2_FcN9fpnf5Cw0xn-YyjorKlDmRllx46AoWqtjsaWRE7jD2UMwSWOCkOAs5AgcjHDjk2OYGR5ANwVofNYd_eyt-puzSyQ-O9GQ22L2pepK39hbDj3ahwNZj-qjDNqtX3FaFWBxM9iPVKF8-JO6QL70zycA=w420-h240-k-no,TRUE,Restaurants in NSP,2020-02-17T07:17:49.853Z,+91 97171 91339
"https://www.google.com/maps/place/Fun+Bytes/@28.6925215,77.1485202,17z/data=!4m8!1m2!2m1!1sRestaurants+in+NSP!3m4!1s0x390d023322b794e9:0x94e9b50add7e2902!8m2!3d28.6936582!4d77.1497285?hl=en",Fun Bytes,4.5,10,Fast food restaurant,Casual · Good for kids · Groups,"Shop No. G88, Aggarwal Millennium Tower 2, NSP, Pitampura, Delhi, 110034, India","M4VX+FV Delhi, India",funbytes.in,,,,,,,,,,Restaurants in NSP,2020-02-17T07:17:50.964Z,
"https://www.google.com/maps/place/chills+n+grills/@28.6925215,77.1485202,17z/data=!4m8!1m2!2m1!1sRestaurants+in+NSP!3m4!1s0x390d02333b6327d3:0x428ae4811341a098!8m2!3d28.693862!4d77.14971?hl=en",chills n grills,4.3,110,Fast food restaurant,Casual · Good for kids · Groups,"g 33, agarwal millinium tower 1, netaji subhash place, pitam pura, New delhi, Delhi 110034, India","M4VX+GV Delhi, India",,,,,,,,,,TRUE,Restaurants in NSP,2020-02-17T07:17:52.515Z,+91 11 4709 7666
"https://www.google.com/maps/place/Bittoo+Tikki+Wala/@28.6925215,77.1485202,17z/data=!4m8!1m2!2m1!1sRestaurants+in+NSP!3m4!1s0x390d0233246d37c7:0x31ceda122a00de8e!8m2!3d28.6938648!4d77.1498015?hl=en",Bittoo Tikki Wala,4.1,1286,North Indian restaurant,Casual · Vegetarian options · Good for kids,"G-46 Aggarwal Millenium Tower, Netaji Subhash Place, New Delhi, Delhi 110034, India","M4VX+GW Delhi, India",btwindia.com,,,,,,,,,TRUE,Restaurants in NSP,2020-02-17T07:17:54.772Z,+91 93111 33112
"https://www.google.com/maps/place/Wheat+Basket+Bakery,+PP+Trade+Centre,+Ground+floor,+Shop+no.+G16,+G17,+G21Netaji+Subash+Place,+New+Delhi,+Delhi+110034,+India/@28.6925215,77.1485202,17z/data=!4m5!1m2!2m1!1sRestaurants+in+NSP!3m1!1s0x390d03dcf7c43e75:0x93ee1ec2e74addab?hl=en",Wheat Basket Bakery,4.7,171,Bakery,Breakfast · Delivery,"PP Trade Centre, Ground floor, Shop no. G16, G17, G21Netaji Subash Place, New Delhi, Delhi 110034, India","M4VX+FC Delhi, India",,,,,,,,,,TRUE,Restaurants in NSP,2020-02-17T07:17:56.661Z,+91 99586 55566
"https://www.google.com/maps/place/McDonald's/@28.6925215,77.1485202,17z/data=!4m8!1m2!2m1!1sRestaurants+in+NSP!3m4!1s0x390d03c5069b16f3:0x4727b92e911ce638!8m2!3d28.6924317!4d77.1527144?hl=en",McDonald's,4.1,1507,Fast food restaurant,Breakfast · Casual · Good for kids,"Anchor No. 1, Ground Floor, D Mall, Near Wazirpur District Center, Netaji Subhash Place, New Delhi, Delhi 110034, India","M5R3+X3 New Delhi, Delhi, India",mcdonaldsindia.com,,,,,,,,https://lh5.googleusercontent.com/p/AF1QipMNwvhGmUbI0V_GJR1Wu-fl5Lr7xHbr6OSyJl0=w427-h240-k-no,TRUE,Restaurants in NSP,2020-02-17T07:17:57.857Z,+91 11 6600 0666
"https://www.google.com/maps/place/Aggarwal+Cyber+Plaza-1/@28.6925215,77.1485202,17z/data=!4m8!1m2!2m1!1sRestaurants+in+NSP!3m4!1s0x390d023310b12e0f:0x644058b28ae94aa4!8m2!3d28.693711!4d77.15004?hl=en",Aggarwal Cyber Plaza-1,4,309,Fast food restaurant,All you can eat · Casual · Good for kids,"Pitampura, Netaji Subhash Place, Shakurpur, Delhi, 110034, India","M5V2+F2 Shakurpur, Delhi, India",unitygroupindia.com,,,,,,,,,TRUE,Restaurants in NSP,2020-02-17T07:17:59.411Z,+91 99533 99130
"https://www.google.com/maps/place/BarShala/@28.6925215,77.1485202,17z/data=!4m8!1m2!2m1!1sRestaurants+in+NSP!3m4!1s0x390d023386a5eae9:0xb9a370e3ea08244!8m2!3d28.6918415!4d77.1520487?hl=en",BarShala,4.5,2043,Bar,Casual · Groups · Beer,"1st Floor, BIGJOS Tower, Netaji Subhash Place, New Delhi, Delhi 110034, India","M5R2+PR New Delhi, Delhi, India",barshala.com,,,,,,,,,TRUE,Restaurants in NSP,2020-02-17T07:18:01.534Z,+91 98918 00000
"https://www.google.com/maps/place/Kitchen+With+A+Cause/@28.6520867,77.1857687,16z/data=!4m8!1m2!2m1!1sRestaurants+in+Karol+Bagh!3m4!1s0x390d029ed645d389:0xc4a11c5d7cb044bb!8m2!3d28.6467142!4d77.189214?hl=en",Kitchen With A Cause,4.4,376,Modern Indian restaurant,All you can eat · Cozy · Casual,"15A/63, Ajmal Khan Rd, Block 15A, WEA, Karol Bagh, New Delhi, Delhi 110005, India","J5WQ+MM Karol Bagh, New Delhi, Delhi, India",business.site,,,,,,,,,TRUE,Restaurants in Karol Bagh,2020-02-17T07:18:17.112Z,+91 11 4021 4461
"https://www.google.com/maps/place/Suruchi+Restaurant/@28.6520867,77.1857687,16z/data=!4m8!1m2!2m1!1sRestaurants+in+Karol+Bagh!3m4!1s0x390d029f2eb884cd:0x8cd01ab0d0dd8772!8m2!3d28.6471297!4d77.1885138?hl=en",Suruchi Restaurant,4.1,1757,Gujarati restaurant,All you can eat · Breakfast · Cozy,"98, 15A/56, WEA Karol Bagh Near Metro Pillar, 99, Ajmal Khan Rd, New Delhi, Delhi 110005, India","J5WQ+VC New Delhi, Delhi, India",suruchirestaurants.com,,,,,,,,https://lh5.googleusercontent.com/p/AF1QipOqj0u2aEw5pS_-spHkIo1wH416sDyPdCi_tn-c=w408-h272-k-no,TRUE,Restaurants in Karol Bagh,2020-02-17T07:18:20.783Z,+91 11 4500 0244
"https://www.google.com/maps/place/The+Feast+House/@28.6520867,77.1857687,16z/data=!4m8!1m2!2m1!1sRestaurants+in+Karol+Bagh!3m4!1s0x390d0298aa18945d:0x275c912b8009cd3f!8m2!3d28.6437368!4d77.1882851?hl=en",The Feast House,4.1,2886,American restaurant,Late-night food · All you can eat · Cozy,"1-B Pusa Road Karol Bagh Near by Karol Bagh Metro Station, New Delhi, Delhi 110005, India","J5VQ+F8 New Delhi, Delhi, India",thefeasthouse.com,,,,,,,,,TRUE,Restaurants in Karol Bagh,2020-02-17T07:18:24.730Z,+91 99587 98198
"https://www.google.com/maps/place/Spicy+By+Nature/@28.6520867,77.1857687,16z/data=!4m8!1m2!2m1!1sRestaurants+in+Karol+Bagh!3m4!1s0x390d029931c2a21d:0xc0fdd0bd3597c973!8m2!3d28.647159!4d77.188324?hl=en",Spicy By Nature,3.7,226,North Indian restaurant,Late-night food · Casual · Groups,"15-A/55, Saraswati Marg, West Extension Area, Karol Bagh, New Delhi, Delhi 110005, India","J5WQ+V8 New Delhi, Delhi, India",,,,,,,,,,TRUE,Restaurants in Karol Bagh,2020-02-17T07:18:28.141Z,+91 11 2573 6328
"https://www.google.com/maps/place/Shudh+Vegetarian+Food+Court/@28.6520867,77.1857687,16z/data=!4m8!1m2!2m1!1sRestaurants+in+Karol+Bagh!3m4!1s0x390d029f40ff6ac9:0x7a37a3ea20283901!8m2!3d28.6454608!4d77.1903736?hl=en",Shudh Vegetarian Food Court,3.8,1503,Vegetarian restaurant,All you can eat · Breakfast · Cozy,"Metro Pillar Number 98, 17A/32, Gurudwara Road W.E.A, Near, 99, Opposite Jessa Ram Hospital, Karol Bagh, New Delhi, Delhi 110005, India","J5WR+54 Karol Bagh, New Delhi, Delhi, India",shudhrestaurant.com,,,,,,,,,TRUE,Restaurants in Karol Bagh,2020-02-17T07:18:30.552Z,+91 11 4500 0366
"https://www.google.com/maps/place/Aroma+Spice/@28.6520867,77.1857687,16z/data=!4m8!1m2!2m1!1sRestaurants+in+Karol+Bagh!3m4!1s0x390d029ed35a1865:0xafde23ead6282614!8m2!3d28.646861!4d77.188793?hl=en",Aroma Spice,3.8,202,Restaurant,Late-night food · Casual · Groups,"15A/61, Saraswati Marg, WEA, Karol Bagh, New Delhi, Delhi 110005, India","J5WQ+PG New Delhi, Delhi, India",,,,,,,,,,TRUE,Restaurants in Karol Bagh,2020-02-17T07:18:31.860Z,+91 11 2573 2639
"https://www.google.com/maps/place/Southy/@28.6520867,77.1857687,16z/data=!4m8!1m2!2m1!1sRestaurants+in+Karol+Bagh!3m4!1s0x390d0298ab279b7f:0x55ec992c8bffcde4!8m2!3d28.6434308!4d77.1887827?hl=en",Southy,3.6,406,South Indian restaurant,Casual · Good for kids · Groups,"B-1/8 , Below Karol Bagh Metro station Gate No.7, Pusa Road, Karol Bagh, New Delhi, Delhi 110005, India","J5VQ+9G New Delhi, Delhi, India",,,,,,,,,https://lh6.googleusercontent.com/proxy/gYW3rAB3s_agff7JVuP4mg0D2Amm2XKZ6_waCiaJI9_Pp2yL3R6S-k7pFRB0Pqp5FtrcpetJMfQVMTVncVsyk9Ehfavp2KB6iSA7Lj-wtXrKMlOPs_pwev6SZuTpSV8ZfQjJSlPSLDZZydchuGPGsjF9LsPbVg=w420-h240-k-no,TRUE,Restaurants in Karol Bagh,2020-02-17T07:18:33.162Z,+91 11 4702 1999
